{
  "schema": "dewee.ui-action.v1",
  "id": "0190a1b2-c3d4-7e5f-8a9b-0c1d2e3f4a18",
  "kind": "command_preview",
  "status": "pending",
  "title": "Create the support agent",
  "body": "This adds one agent to your workspace.",
  "payload": {
    "command": [
      "dewee",
      "agent",
      "create",
      "--name",
      "support",
      "-o",
      "json"
    ],
    "description": "Creates an agent named support",
    "policy_class": "reversible_config",
    "policy_outcome": "batch_allowed"
  },
  "created_at": "2026-10-06T10:00:00Z",
  "expires_at": "2026-10-13T10:00:00Z"
}
