{
  "schema": "dewee.ui-action.v1",
  "id": "0190a1b2-c3d4-7e5f-8a9b-0c1d2e3f4a13",
  "kind": "permission_request",
  "status": "pending",
  "title": "Approve connecting a credential",
  "body": "The setup agent wants to give the helper agent access to GitHub.",
  "payload": {
    "approval_id": "appr_0190a1b2c3d4",
    "risk_class": "setup.credential_grant",
    "command_path": "cli-credentials grants create",
    "command": [
      "dewee",
      "cli-credentials",
      "grants",
      "create",
      "--binary",
      "gh",
      "--agent",
      "helper"
    ],
    "reason": "credential_grant",
    "scope": "write"
  },
  "created_at": "2026-10-06T10:00:00Z",
  "expires_at": "2026-10-13T10:00:00Z"
}
