{
  "schema": "dewee.ui-action.v1",
  "id": "0190a1b2-c3d4-7e5f-8a9b-0c1d2e3f4a14",
  "kind": "install_request",
  "status": "pending",
  "title": "Approve installing ripgrep",
  "body": "The setup agent needs a fast text search tool.",
  "payload": {
    "approval_id": "appr_0190a1b2c3d5",
    "package": "ripgrep",
    "runtime": "apt",
    "version": "14.1.0",
    "reason": "package_install"
  },
  "created_at": "2026-10-06T10:00:00Z",
  "expires_at": "2026-10-13T10:00:00Z"
}
