{
  "schema": "dewee.ui-action.v1",
  "id": "0190a1b2-c3d4-7e5f-8a9b-0c1d2e3f4a15",
  "kind": "upload_request",
  "status": "pending",
  "title": "Upload your product FAQ",
  "body": "The agent uses it to answer customer questions.",
  "payload": {
    "purpose": "knowledge_base",
    "accept": [
      "application/pdf",
      ".md"
    ],
    "max_bytes": 10485760,
    "multiple": true
  },
  "created_at": "2026-10-06T10:00:00Z",
  "expires_at": "2026-10-13T10:00:00Z"
}
