{
  "schema": "dewee.ui-action.v1",
  "id": "0190a1b2-c3d4-7e5f-8a9b-0c1d2e3f4a19",
  "kind": "setup_progress",
  "status": "pending",
  "title": "Setting up your workspace",
  "payload": {
    "plan_revision": 4,
    "completed": 2,
    "total": 4,
    "current_step_id": "bootstrap"
  },
  "created_at": "2026-10-06T10:00:00Z",
  "expires_at": "2026-10-13T10:00:00Z"
}
