{
  "schema": "dewee.ui-action.v1",
  "id": "0190a1b2-c3d4-7e5f-8a9b-0c1d2e3f4a11",
  "kind": "secret_request",
  "status": "pending",
  "title": "Connect OpenAI",
  "body": "Paste your key in the secure box. The agent never sees it.",
  "payload": {
    "target": {
      "type": "provider",
      "mode": "create",
      "name": "openai",
      "provider_type": "openai"
    },
    "fields": [
      {
        "key": "api_key",
        "label": "API key",
        "kind": "secret",
        "required": true
      }
    ]
  },
  "created_at": "2026-10-06T10:00:00Z",
  "expires_at": "2026-10-13T10:00:00Z"
}
