{
  "schema": "dewee.ui-action.v1",
  "id": "0190a1b2-c3d4-7e5f-8a9b-0c1d2e3f4a1a",
  "kind": "handoff",
  "status": "pending",
  "title": "Your Super Agent is ready",
  "body": "Continue the conversation with your agent.",
  "payload": {
    "purpose": "super_agent",
    "session_key": "agent:super-agent:app:direct:0190a1b2",
    "agent_key": "super-agent"
  },
  "created_at": "2026-10-06T10:00:00Z",
  "expires_at": "2026-10-13T10:00:00Z"
}
