{
  "schema": "dewee.ui-action.v1",
  "id": "0190a1b2-c3d4-7e5f-8a9b-0c1d2e3f4a12",
  "kind": "oauth_request",
  "status": "pending",
  "title": "Sign in with ChatGPT",
  "body": "Use your existing ChatGPT subscription.",
  "payload": {
    "provider": "chatgpt"
  },
  "created_at": "2026-10-06T10:00:00Z",
  "expires_at": "2026-10-13T10:00:00Z"
}
